47662100	HPDrain	Debuff	False	perc	30000	0	0.9	Klebrigkeit			Verringert die Bewegungsgeschwindigkeit um $H_W_BAD50%$COLOR_END. Klebrigkeit kann nicht entfernt werden.	icon_status.minusmove_tex	icon_status.minusmove_tex	True
47662110	Endurance	Debuff	False	perc	3000	0	1	Zur KI-Prüfung			Zur KI-Prüfung	icon_skills.voidtrap_tex	icon_skills.voidtrap_tex	False
47662120	ASpd	Buff	True	perc	86400000	0	1.05	Ölen			Erhöht die Angriffsgeschwindigkeit um $H_W_GOOD5%$COLOR_END. Dieser Effekt kann bis zu 3-mal akkumuliert werden.	icon_status.plusmove_tex	icon_status.plusmove_tex	True
47662130	AtkPotion	Buff	True	perc	30000	0	2	Perfekte Maschine			100% Resistenz gegen jeglichen Schaden. Erhöht den Fertigkeitsschaden um $H_W_GOOD100%$COLOR_END.	icon_status.plusattack_tex	icon_status.plusattack_tex	True
47662130	Immune	Buff	True	seta	30000	0	0	Perfekte Maschine			100% Resistenz gegen jeglichen Schaden. Erhöht den Fertigkeitsschaden um $H_W_GOOD100%$COLOR_END.	icon_status.plusattack_tex	icon_status.plusattack_tex	True
47662140	StackCounter	Buff	True	swch	3000	0	476621	Zzz...			10-mal akkumuliert verursacht Zzz... Tiefschlaf.	icon_status.sleepstatus_tex	icon_status.sleepstatus_tex	True
47662200	Immune	Buff	True	17	20000	0	0	Macht der Kokosnuss			Unverwundbar gegen Schaden. Kann nicht niedergeschlagen oder bewegungsunfähig gemacht werden.	icon_status.plusedefence_tex	icon_status.plusedefence_tex	True
47662300	Drunk	Debuff	False	60010	35000	0	0	Finsternis I			Ihr erblindet nach und nach.	icon_status.darkeffect_tex	icon_status.darkeffect_tex	True
47662500	Endurance	Debuff	False	perc	20000	0	0.9	Traurigkeit der Mutter			Verringert die Konstitution um $H_W_BAD10%$COLOR_END. Traurigkeit der Mutter kann bis zu 6-mal akkumuliert werden.	icon_status.minusdefence_tex	icon_status.minusdefence_tex	True
47662600	DefPotion	Buff	True	perc	3600000	0	0.9	Kraft des Golems			Verringert den durch elektrischen Strom erlittenen Schaden um $H_W_GOOD10%$COLOR_END.	icon_status.minusdefence_tex	icon_status.minusdefence_tex	True
47662700	StackCounter	Debuff	False	swch	30000	0	476625	Einfacher Elektroschock			Elektroschock kann bis zu 4-mal akkumuliert werden.	icon_skills.voidtrap_tex	icon_skills.voidtrap_tex	False
47662800	Endurance	Buff	True	perc	45000	0	3	Zeit der Unsterblichkeit			100% Resistenz gegen alle schädlichen Effekte. Erhöht die Konstitution um $H_W_GOOD200%$COLOR_END.	icon_status.immunedebuff_tex	icon_status.immunedebuff_tex	True
47662800	ResistNegative	Buff	True	swch	45000	0	0	Zeit der Unsterblichkeit			100% Resistenz gegen alle schädlichen Effekte. Erhöht die Konstitution um $H_W_GOOD200%$COLOR_END.	icon_status.immunedebuff_tex	icon_status.immunedebuff_tex	True
47670100	Absorb	Buff	True	swch	5000	0	300000	Arkane Ägide			Absorbiert bis zu $H_W_GOOD300000.0$COLOR_END Schaden.$BRArkane Ägide kann nicht entfernt werden.	icon_skills.manashield_tex	icon_skills.manashield_tex	True
47670101	DefPotion	Buff	True	perc	5000	0	0	Arkane Ägide			Absorbiert bis zu $H_W_GOOD100%$COLOR_END Schaden.$BRArkane Ägide kann nicht entfernt werden.	icon_skills.manashield_tex	icon_skills.manashield_tex	True
47670200	Power	Buff	True	perc	600000	0	1.05	Raserei des Kriegers			Raserei und Schmerz erhöhen die Kraft um $H_W_GOOD5%$COLOR_END und die Bewegungsgeschwindigkeit um $H_W_GOOD5%$COLOR_END. Verringert die Konstitution um $H_W_BAD5%$COLOR_END. Raserei des Kriegers kann nicht entfernt werden.	icon_status.angerwarrior_tex	icon_status.angerwarrior_tex	True
47670200	Endurance	Buff	True	perc	600000	0	0.95	Raserei des Kriegers			Raserei und Schmerz erhöhen die Kraft um $H_W_GOOD5%$COLOR_END und die Bewegungsgeschwindigkeit um $H_W_GOOD5%$COLOR_END. Verringert die Konstitution um $H_W_BAD5%$COLOR_END. Raserei des Kriegers kann nicht entfernt werden.	icon_status.angerwarrior_tex	icon_status.angerwarrior_tex	True
47670200	MovSpd	Buff	True	perc	600000	0	1.05	Raserei des Kriegers			Raserei und Schmerz erhöhen die Kraft um $H_W_GOOD5%$COLOR_END und die Bewegungsgeschwindigkeit um $H_W_GOOD5%$COLOR_END. Verringert die Konstitution um $H_W_BAD5%$COLOR_END. Raserei des Kriegers kann nicht entfernt werden.	icon_status.angerwarrior_tex	icon_status.angerwarrior_tex	True
47670300	Power	Buff	True	perc	30000	0	2	Elan des Kameraden			Großer Elan erhöht die Kraft um $H_W_GOOD100%$COLOR_END. Elan des Kameraden kann nicht entfernt werden.	icon_status.plusattack_tex	icon_status.plusattack_tex	True
47670400	Power	Debuff	False	perc	600000	0	0.5	Dagons Zehrung			Verringert die Kraft um $H_W_BAD50%$COLOR_END, die Angriffsgeschwindigkeit um $H_W_BAD50%$COLOR_END und die Bewegungsgeschwindigkeit um $H_W_BAD80%$COLOR_END. Dagons Zehrung kann nicht entfernt werden.	icon_status.risindagon_tex	icon_status.risindagon_tex	True
47670400	MovSpd	Debuff	False	perc	600000	0	0.2	Dagons Zehrung			Verringert die Kraft um $H_W_BAD50%$COLOR_END, die Angriffsgeschwindigkeit um $H_W_BAD50%$COLOR_END und die Bewegungsgeschwindigkeit um $H_W_BAD80%$COLOR_END. Dagons Zehrung kann nicht entfernt werden.	icon_status.risindagon_tex	icon_status.risindagon_tex	True
47670400	ASpd	Debuff	False	perc	600000	0	0.5	Dagons Zehrung			Verringert die Kraft um $H_W_BAD50%$COLOR_END, die Angriffsgeschwindigkeit um $H_W_BAD50%$COLOR_END und die Bewegungsgeschwindigkeit um $H_W_BAD80%$COLOR_END. Dagons Zehrung kann nicht entfernt werden.	icon_status.risindagon_tex	icon_status.risindagon_tex	True
47670400	HPDrain	Debuff	False	perc	600000	0	0.9	Dagons Zehrung			Verringert die Kraft um $H_W_BAD50%$COLOR_END, die Angriffsgeschwindigkeit um $H_W_BAD50%$COLOR_END und die Bewegungsgeschwindigkeit um $H_W_BAD80%$COLOR_END. Dagons Zehrung kann nicht entfernt werden.	icon_status.risindagon_tex	icon_status.risindagon_tex	True
47670500	BuffNearbyParty	Debuff	False	swch	3000	4	476705	Dagons Reinigung			Verringert die MP von Gruppenmitgliedern innerhalb von 2m, mit Ausnahme Eurer eigenen. Dagons Reinigung kann nicht entfernt werden.	icon_status.purifydagon_tex	icon_status.purifydagon_tex	True
47670600	RestoreHpOnHit	Buff	True	abs	300000	0	500	Yuantis Blutfleck			Der Blutfleck heilt sofort $H_W_GOOD500.0$COLOR_END LP, wenn eine Fertigkeit ihr Ziel trifft. Yuantis Blutfleck kann nicht entfernt werden.	icon_status.blooduanty_tex	icon_status.blooduanty_tex	True
47670700	Immune	Debuff	True	seta	10000	0	0	Göttlicher Segen			100% Resistenz gegen schädliche Effekte.$BRGöttlicher Segen kann nicht entfernt werden.	icon_status.holybless_tex	icon_status.holybless_tex	False
47670800	ResistNegative	Buff	True	swch	45000	0	0	Schild des Wahnsinns			100% Resistenz gegen schädliche Effekte.	icon_status.immunedebuff_tex	icon_status.immunedebuff_tex	False
47670900	HPLoss	Debuff	True	abs	3000	0	-10000000	Auslöschung			Wenn der Effekt endet, sterbt Ihr.$BRAuslöschung kann nicht entfernt werden.	icon_status.delaydamage_tex	icon_status.delaydamage_tex	True
47671000	Block	Stun	False	swch	10000	0	0	Entkräftet			Eure Energie ist aufgebraucht! Ihr könnt keine Fertigkeiten benutzen.	icon_status.sealskill_tex	icon_status.sealskill_tex	True
47680000	Power	Debuff	True	perc	300000	0	2.5	Fanatismus des Nexus			Fanatismus erhöht die Kraft um $H_W_GOOD150%$COLOR_END und die Wahrscheinlichkeit, niedergeschlagen oder bewegungsunfähig gemacht zu werden, um $H_W_GOOD100%$COLOR_END. Erhöht die Bewegungsgeschwindigkeit um $H_W_GOOD50%$COLOR_END und die Angriffsgeschwindigkeit um $H_W_GOOD50%$COLOR_END.	icon_skills.voidtrap_tex	icon_skills.voidtrap_tex	True
47680000	MovSpd	Debuff	True	perc	300000	0	1.5	Fanatismus des Nexus			Fanatismus erhöht die Kraft um $H_W_GOOD150%$COLOR_END und die Wahrscheinlichkeit, niedergeschlagen oder bewegungsunfähig gemacht zu werden, um $H_W_GOOD100%$COLOR_END. Erhöht die Bewegungsgeschwindigkeit um $H_W_GOOD50%$COLOR_END und die Angriffsgeschwindigkeit um $H_W_GOOD50%$COLOR_END.	icon_skills.voidtrap_tex	icon_skills.voidtrap_tex	True
47680000	ImpactEffective	Debuff	True	perc	300000	0	2	Fanatismus des Nexus			Fanatismus erhöht die Kraft um $H_W_GOOD150%$COLOR_END und die Wahrscheinlichkeit, niedergeschlagen oder bewegungsunfähig gemacht zu werden, um $H_W_GOOD100%$COLOR_END. Erhöht die Bewegungsgeschwindigkeit um $H_W_GOOD50%$COLOR_END und die Angriffsgeschwindigkeit um $H_W_GOOD50%$COLOR_END.	icon_skills.voidtrap_tex	icon_skills.voidtrap_tex	True
47680000	ASpd	Debuff	True	perc	300000	0	1.5	Fanatismus des Nexus			Fanatismus erhöht die Kraft um $H_W_GOOD150%$COLOR_END und die Wahrscheinlichkeit, niedergeschlagen oder bewegungsunfähig gemacht zu werden, um $H_W_GOOD100%$COLOR_END. Erhöht die Bewegungsgeschwindigkeit um $H_W_GOOD50%$COLOR_END und die Angriffsgeschwindigkeit um $H_W_GOOD50%$COLOR_END.	icon_skills.voidtrap_tex	icon_skills.voidtrap_tex	True
47680100	RestoreHpOnHit	Debuff	True	perc	300000	0	1.03	Düsteres Wissen			Heilt $H_W_GOOD3%$COLOR_END LP, wenn eine Fertigkeit ihr Ziel trifft.	icon_skills.voidtrap_tex	icon_skills.voidtrap_tex	True
47680200	Power	Buff	True	perc	0	0	3	Raserei des Nexus			Nexusenergie durchflutet Eure Gliedmaßen! $H_W_GOODVerdreifacht$COLOR_END die Kraft und $H_W_GOODverdoppelt$COLOR_END den Aufprallfaktor.$BRRaserei des Nexus kann nicht entfernt werden.	icon_status.darkriftrage_tex	icon_status.darkriftrage_tex	True
47680200	ImpactEffective	Buff	True	perc	0	0	2	Raserei des Nexus			Nexusenergie durchflutet Eure Gliedmaßen! $H_W_GOODVerdreifacht$COLOR_END die Kraft und $H_W_GOODverdoppelt$COLOR_END den Aufprallfaktor.$BRRaserei des Nexus kann nicht entfernt werden.	icon_status.darkriftrage_tex	icon_status.darkriftrage_tex	True
47680300	Power	Buff	True	perc	0	0	3	Schwall des Nexus			Nexusenergie beschleunigt Euch! $H_W_GOODVerdoppelt$COLOR_END die Bewegungsgeschwindigkeit und $H_W_GOODverdreifacht$COLOR_END die Kraft.$BRSchwall des Nexus kann nicht entfernt werden.	icon_status.darkriftrage_tex	icon_status.darkriftrage_tex	True
47680300	ASpd	Buff	True	perc	0	0	2	Schwall des Nexus			Nexusenergie beschleunigt Euch! $H_W_GOODVerdoppelt$COLOR_END die Bewegungsgeschwindigkeit und $H_W_GOODverdreifacht$COLOR_END die Kraft.$BRSchwall des Nexus kann nicht entfernt werden.	icon_status.darkriftrage_tex	icon_status.darkriftrage_tex	True
47680400	RestoreHpOnHit	Buff	True	perc	0	0	1.002	Regeneration des Nexus			Heilt bei jedem erfolgreichen Treffer $H_W_GOOD0,2%$COLOR_END der Gesamt-LP. $BRRegeneration des Nexus kann nicht entfernt werden.	icon_status.darkriftrecovery_tex	icon_status.darkriftrecovery_tex	True
47680500	Power	Buff	True	perc	600000	0	1.5	Eifer des Nexus			Erhöht bei jeder Akkumulation die Kraft und Konstitution um $H_W_GOOD50%$COLOR_END. Eifer des Nexus kann nicht entfernt werden und kann bis zu 10-mal akkumuliert werden.	icon_status.darkriftwill_tex	icon_status.darkriftwill_tex	True
47680500	Endurance	Buff	True	perc	600000	0	1.5	Eifer des Nexus			Erhöht bei jeder Akkumulation die Kraft und Konstitution um $H_W_GOOD50%$COLOR_END. Eifer des Nexus kann nicht entfernt werden und kann bis zu 10-mal akkumuliert werden.	icon_status.darkriftwill_tex	icon_status.darkriftwill_tex	True
47680600	StackCounter	Debuff	False	seta	15000	0	476806	Fluch des Nexus			Wenn der Fluch des Nexus $H_W_BAD5$COLOR_END-mal akkumuliert wird, bricht der Nexus über Euch zusammen und tötet Euch auf der Stelle.$BRFluch des Nexus kann nicht entfernt werden.	icon_status.darkriftwhisper_tex	icon_status.darkriftwhisper_tex	True
47680700	Power	Buff	True	perc	600000	0	1	Wutausbruch			Oh, ich glaube, das Musterexperiment ist gescheitert ... Ihr seht wütend aus ...	icon_status.diseaseup_tex	icon_status.diseaseup_tex	True
47680800	MaxHP	Buff	True	perc	7200000	0	1.05	Jenseitiger			Erhöht die Gesamt-LP um $H_W_GOOD5%$COLOR_END pro Akkumulation.	icon_status.darkriftgravity_tex	icon_status.darkriftgravity_tex	True
47680900	251	Buff	True	perc	7200000	0	0.2	Freigiebigkeit des Nexus			Mit wachsender Anzahl der Gruppenmitglieder steigt auch die Wahrscheinlichkeit, dass Ihr materielle Belohnungen erhaltet.	icon_status.darkriftreward_tex	icon_status.darkriftreward_tex	True
47681000	Power	Debuff	True	perc	20000	0	1.1	Fanatismus des Nexus			Erhöht bei jeder Akkumulation die Kraft um $H_W_GOOD10%$COLOR_END. Fanatismus des Nexus kann bis zu 5-mal akkumuliert und nicht entfernt werden.	icon_status.darkriftarearage_tex	icon_status.darkriftarearage_tex	True
47681100	CDR	Debuff	True	perc	20000	0	0.9	Flinkheit des Nexus			Verringert bei jeder Akkumulation die Abklingzeit aller Fertigkeiten um $H_W_GOOD10%$COLOR_END. Flinkheit des Nexus kann bis zu 5-mal akkumuliert und nicht entfernt werden.	icon_status.darkriftareatimeshift_tex	icon_status.darkriftareatimeshift_tex	True
47681200	ASpd	Debuff	True	perc	20000	0	1.1	Eile des Nexus			Erhöht bei jeder Akkumulation die Angriffsgeschwindigkeit um $H_W_GOOD10%$COLOR_END. Eile des Nexus kann bis zu 5-mal akkumuliert und nicht entfernt werden.	icon_status.darkriftareawind_tex	icon_status.darkriftareawind_tex	True
47681300	253	Debuff	True	perc	20000	0	1	Fluch des Nexus			Erhöht den Fertigkeitsschaden jedes Mal, wenn die Menge der Ziele erhöht wird, um $H_W_GOOD50%$COLOR_END bei bis zu maximal fünf Zielen mit $H_W_GOOD3-fach$COLOR_END erhöhtem Fertigkeitsschaden. Fluch des Nexus kann bis zu 5-mal akkumuliert und nicht entfernt werden.	icon_status.darkriftareasword_tex	icon_status.darkriftareasword_tex	True
47681400	Power	Debuff	True	perc	20000	0	1.2	Laune des Nexus			Erhöht bei jeder Akkumulation die Kraft um $H_W_GOOD20%$COLOR_END. Wird Laune des Nexus 5-mal akkumuliert, seid Ihr gezwungen zu tanzen und der Zähler wird zurückgesetzt. Laune des Nexus kann nicht entfernt werden.	icon_status.darkriftareadance_tex	icon_status.darkriftareadance_tex	True
47681400	StackCounter	Debuff	True	seta	20000	0	476814	Laune des Nexus			Erhöht bei jeder Akkumulation die Kraft um $H_W_GOOD20%$COLOR_END. Wird Laune des Nexus 5-mal akkumuliert, seid Ihr gezwungen zu tanzen und der Zähler wird zurückgesetzt. Laune des Nexus kann nicht entfernt werden.	icon_status.darkriftareadance_tex	icon_status.darkriftareadance_tex	True
47681600	Endurance	Buff	True	perc	3600000	0	1	Ruf des Nexus			Ihr werdet in den Nexus gezogen. Ihr könnt die Nexustraverse betreten.$BRDie 2-stündige Abklingzeit für die Nexustraverse gilt für alle Charaktere dieses Kontos.	icon_status.calldimension_tex	icon_status.calldimension_tex	True
47681601	Endurance	Buff	True	perc	3600000	0	1	Ruf des Nexus			Ihr werdet in den Nexus gezogen. Ihr könnt die Nexustraverse betreten.$BRDie 2-stündige Abklingzeit für die Nexustraverse gilt für alle Charaktere dieses Kontos.	icon_status.calldimension_tex	icon_status.calldimension_tex	True
47681602	Endurance	Buff	True	perc	3600000	0	1	Ruf des Nexus			Ihr werdet in den Nexus gezogen. Ihr könnt die Nexustraverse betreten.$BRDie 2-stündige Abklingzeit für die Nexustraverse gilt für alle Charaktere dieses Kontos.	icon_status.calldimension_tex	icon_status.calldimension_tex	True
47681700	Endurance	Buff	True	perc	7200000	0	1	Dimensionaler Anker			Ihr habt kürzlich die Nexustraverse erkundet. Ihr könnt nicht wieder in die Nexustraverse eintreten.	icon_status.dimensionguard_tex	icon_status.dimensionguard_tex	True
47681800	Plague	Buff	True	seta	3600000	5	476818	Leiter des Nexus			Durchdringt Verbündete innerhalb von 12m immer nach $H_W_GOOD5s$COLOR_END mit Nexusenergie.	icon_status.darkriftareatimeshift_tex	icon_status.darkriftareatimeshift_tex	True
47690000	Block	Stun	False	swch	10000	0	0	Ultraschallaufprall			Ihr könnt keine Fertigkeiten benutzen, solange der Effekt wirkt.$BRDieser Effekt kann nicht entfernt werden.	icon_status.sealskill_tex	icon_status.sealskill_tex	True
47690100	Endurance	Debuff	False	perc	60000	0	0.2	Zertrampelt			Verringert die Konstitution um $H_W_BAD80%$COLOR_END.$BRDieser Effekt kann nicht entfernt werden.	icon_status.minusdefence_tex	icon_status.minusdefence_tex	True
47690200	DefPotion	Buff	True	perc	0	0	0.2	Roter Schild			Reduziert den durch Distanzangriffe erlittenen Schaden um $H_W_GOOD80%$COLOR_END.$BRRoter Schild kann nicht entfernt werden.	icon_status.plusedefence_tex	icon_status.plusedefence_tex	True
47690300	DefPotion	Buff	True	perc	0	0	0.2	Blauer Schild			Reduziert den durch Nahangriffe erlittenen Schaden um $H_W_GOOD80%$COLOR_END.$BRBlauer Schild kann nicht entfernt werden.	icon_status.plusedefence_tex	icon_status.plusedefence_tex	True
47690400	Stun	Stun	False	swch	0	0	5	Energieentzug			Ihr seid betäubt und bewegungsunfähig.$BREnergieentzug kann nicht entfernt werden.	icon_status.confuseup_tex	icon_status.confuseup_tex	True
47690500	Plague	Debuff	False	seta	15000	2	476905	Elektrischer Stoß			Schlägt immer nach $H_W_GOOD2s$COLOR_END Verbündete innerhalb von 10m nieder und macht sie bewegungsunfähig. Elektrischer Stoß hebt Energieentzug auf.$BRElektrischer Stoß kann nicht entfernt werden.	icon_status.paralyzestatus_tex	icon_status.paralyzestatus_tex	True
47690600	Plague	Debuff	False	seta	3000	1	476906	Todeshand			Trefft Verbündete in der Nähe mit einer Todesberührung, die immer nach $H_W_BAD1s$COLOR_END $H_W_BAD50%$COLOR_END ihrer gesamten LP entzieht, wenn Todeshand endet.	icon_status.poisonstatus_tex	icon_status.poisonstatus_tex	True
47690700	DelayedEffect	DOT	False	abs	5000	0	476907	Geistige Wunde			Trefft Verbündete in der Nähe mit Geistiger Zusammenbruch, der sie betäubt, bewegungsunfähig macht und LP entzieht, wenn Geistige Wunde endet.	icon_status.confuseup_tex	icon_status.confuseup_tex	True
47690800	HPChange	Debuff	False	perc	10000	10	-0.1	Starren der Tiefe			Zieht $H_W_BAD10%$COLOR_END Eurer gesamten LP ab, wenn Starren der Tiefe endet.$BRStarren der Tiefe kann nicht entfernt werden.	icon_status.minushp_tex	icon_status.minushp_tex	True
47690800	StackCounter	Debuff	False	swch	10000	0	47690900	Starren der Tiefe			Zieht $H_W_BAD10%$COLOR_END Eurer gesamten LP ab, wenn Starren der Tiefe endet.$BRStarren der Tiefe kann nicht entfernt werden.	icon_status.minushp_tex	icon_status.minushp_tex	True
47690900	HPLoss	DOT	False	abs	10000	0	-10000000	Griff der Tiefe			Ihr sterbt, wenn Griff der Tiefe endet.$BRGriff der Tiefe kann nicht entfernt werden.	icon_status.delaydamage_tex	icon_status.delaydamage_tex	True
47691000	MPChange	Debuff	False	perc	5000	1	-100000000	Manaqual			Verringert die MP auf $H_W_BAD0$COLOR_END und verhindert die MP-Wiederherstellung.$BRManaqual kann nicht entfernt werden.	icon_status.minusmp_tex	icon_status.minusmp_tex	True
47691000	NoHeal	Debuff	False	abs	5000	0	0	Manaqual			Verringert die MP auf $H_W_BAD0$COLOR_END und verhindert die MP-Wiederherstellung.$BRManaqual kann nicht entfernt werden.	icon_status.minusmp_tex	icon_status.minusmp_tex	True
47700000	MovSpd	Buff	True	perc	0	0	1.5	Flinkheit			Erhöht die Bewegungsgeschwindigkeit um $H_W_GOOD50%$COLOR_END und die Angriffsgeschwindigkeit um $H_W_GOOD50%$COLOR_END.$BRFlinkheit kann nicht entfernt werden.	icon_status.plusmove_tex	icon_status.plusmove_tex	True
47700000	ASpd	Buff	True	perc	0	0	1.5	Flinkheit			Erhöht die Bewegungsgeschwindigkeit um $H_W_GOOD50%$COLOR_END und die Angriffsgeschwindigkeit um $H_W_GOOD50%$COLOR_END.$BRFlinkheit kann nicht entfernt werden.	icon_status.plusmove_tex	icon_status.plusmove_tex	True
47700100	HPChange	DOT	False	perc	5000	1	-0.2	Verzehrende Krankheit			Zieht immer nach $H_W_BAD1s$COLOR_END $H_W_BAD$20%$COLOR_END der Gesamt-LP ab.$BRVerzehrende Krankheit kann nicht entfernt werden.	icon_status.poisonstatus_tex	icon_status.poisonstatus_tex	True
47700200	HPLoss	DOT	False	abs	10000	0	-10000000	Zerstörung der Starken			Ihr sterbt, wenn Ihr $H_W_GOODüber 50%$COLOR_END Eurer LP habt und Zerstörung der Starken endet.$BRZerstörung der Starken kann nicht entfernt werden.	icon_status.firedamage_tex	icon_status.firedamage_tex	True
47700300	HPLoss	DOT	False	abs	10000	0	-10000000	Zerstörung der Schwachen			Ihr sterbt, wenn Ihr $H_W_GOODweniger als 50%$COLOR_END Eurer LP habt und Zerstörung der Schwachen endet.$BRZerstörung der Schwachen kann nicht entfernt werden.	icon_status.firedamage_tex	icon_status.firedamage_tex	True
47700400	Endurance	Debuff	False	perc	10000	0	0.5	Unreinheit			Verringert die Konstitution um $H_W_BAD50%$COLOR_END.$BRUnreinheit kann nicht entfernt werden.	icon_status.minusdefence_tex	icon_status.minusdefence_tex	True
47700500	Endurance	Debuff	False	perc	10000	0	0.5	Vergängliches Chitin			Erhöht die Konstitution um $H_W_BAD50%$COLOR_END, aber reduziert die Bewegungsgeschwindigkeit um $H_W_BAD50%$COLOR_END.$BRVergängliches Chitin kann nicht entfernt werden.	icon_status.minusdefence_tex	icon_status.minusdefence_tex	True
47700500	MovSpd	Debuff	False	perc	10000	0	0.5	Vergängliches Chitin			Erhöht die Konstitution um $H_W_BAD50%$COLOR_END, aber reduziert die Bewegungsgeschwindigkeit um $H_W_BAD50%$COLOR_END.$BRVergängliches Chitin kann nicht entfernt werden.	icon_status.minusdefence_tex	icon_status.minusdefence_tex	True
47700500	HPDrain	Debuff	False	perc	10000	0	0.9	Vergängliches Chitin			Erhöht die Konstitution um $H_W_BAD50%$COLOR_END, aber reduziert die Bewegungsgeschwindigkeit um $H_W_BAD50%$COLOR_END.$BRVergängliches Chitin kann nicht entfernt werden.	icon_status.minusdefence_tex	icon_status.minusdefence_tex	True
47700600	Endurance	Buff	True	perc	60000	0	1	Magnetischer Südpol			Ihr seid magnetisch und zieht alle Manaathol in der Umgebung an.$BRMagnetischer Südpol kann nicht abgebrochen werden.	icon_status.plusedefence_tex	icon_status.plusedefence_tex	True
47700700	Endurance	Buff	True	perc	60000	0	1	Magnetischer Nordpol			Ihr seid magnetisch und zieht alle Manaathol in der Umgebung an.$BRMagnetischer Nordpol kann nicht abgebrochen werden.	icon_status.plusedefence_tex	icon_status.plusedefence_tex	True
47700800	HPChange	DOT	False	perc	30000	1	-0.02	Parasit			Verringert alle $H_W_BAD1s$COLOR_END die Gesamt-LP um $H_W_BAD2%$COLOR_END. Kann bis zu 5-mal akkumuliert werden.$BRHüpft auf der Stelle, um die Parasiten abzuschütteln.$BRParasit kann auf keine andere Art entfernt werden.	icon_status.minusattack_tex	icon_status.minusattack_tex	True
47700800	Drunk	DOT	False	426717	30000	0	0	Parasit			Verringert alle $H_W_BAD1s$COLOR_END die Gesamt-LP um $H_W_BAD2%$COLOR_END. Kann bis zu 5-mal akkumuliert werden.$BRHüpft auf der Stelle, um die Parasiten abzuschütteln.$BRParasit kann auf keine andere Art entfernt werden.	icon_status.minusattack_tex	icon_status.minusattack_tex	True
47700800	StackCounter	DOT	False	swch	30000	0	477007	Parasit			Verringert alle $H_W_BAD1s$COLOR_END die Gesamt-LP um $H_W_BAD2%$COLOR_END. Kann bis zu 5-mal akkumuliert werden.$BRHüpft auf der Stelle, um die Parasiten abzuschütteln.$BRParasit kann auf keine andere Art entfernt werden.	icon_status.minusattack_tex	icon_status.minusattack_tex	True
47701000	Immune	Buff	True	30	0	0	0	Existenzieller Schild			Eure Lebensenergie manifestiert sich in Form eines Schutzschildes. 100% Resistenz gegen alle schädlichen Effekte.$BRExistenzieller Schild kann nicht entfernt werden.	icon_status.immunedebuff_tex	icon_status.immunedebuff_tex	True
47701100	Endurance	Debuff	False	seta	0	0	100	Neutralisierung			Setzt die Konstitution auf $H_W_BAD100$COLOR_END.$BRNeutralisierung kann nicht entfernt werden.	icon_status.plusedefence_tex	icon_status.plusedefence_tex	True
47701200	Endurance	Buff	True	perc	0	0	1	Stahlgeist			Die Argonenkönigin ignoriert jegliche Aggro.$BRStahlgeist kann nicht entfernt werden.	icon_status.diffusionaggro_tex	icon_status.diffusionaggro_tex	True
47701300	Endurance	Buff	True	perc	0	0	1	Geschwächter Geist			Die Argonenkönigin stützt sich auf Aggro.$BRGeschwächter Geist kann nicht entfernt werden.	icon_status.stackabnormality_tex	icon_status.stackabnormality_tex	True
47701400	Endurance	Debuff	False	perc	40000	0	1	Argonenmetastase			Löst bei 5-maliger Akkumulation Systembefall aus.	icon_status.poisonstatus_tex	icon_status.poisonstatus_tex	True
47701400	StackCounter	Debuff	False	swch	40000	0	477014	Argonenmetastase			Löst bei 5-maliger Akkumulation Systembefall aus.	icon_status.poisonstatus_tex	icon_status.poisonstatus_tex	True
47701600	101	Buff	True	perc	5000	0	1.05	Welle der Erleichterung			Heilt $H_W_GOOD5%$COLOR_END der LP bei Angriffen.$BRWelle der Erleichterung kann nicht entfernt werden.	icon_status.plushp_tex	icon_status.plushp_tex	True
47701700	StackCounter	Buff	True	swch	20000	0	477026	Kreischen der Königin			Verursacht bei 5-maliger Akkumulierung Zorn der Königin.	icon_status.plusattack_tex	icon_status.plusattack_tex	True
47701800	DelayedEffect	Debuff	False	swch	5000	0	477014	Argonenmutagen			Wenn Argonenmutagen endet, verursacht es Systembefall.	icon_status.confuseup_tex	icon_status.confuseup_tex	True
47701900	Endurance	Buff	False	perc	0	0	1	Positiv			Positiv geladen.	icon_status.plusabnormality_tex	icon_status.plusabnormality_tex	True
47702000	Endurance	Buff	False	perc	0	0	1	Negativ			Negativ geladen.	icon_status.minusabnormality_tex	icon_status.minusabnormality_tex	True
47702100	HPChange	DOT	False	perc	10000	1	-0.1	Zellverfall			Zieht für einen bestimmten Zeitraum immer nach $H_W_BAD1s$COLOR_END $H_W_BAD10%$COLOR_END der Gesamt-LP ab. Zieht danach $H_W_BAD-30000.0$COLOR_END der Gesamt-LP ab.$BRZellverfall kann nicht entfernt werden.	icon_status.delaydamage_tex	icon_status.delaydamage_tex	True
47702100	HPLoss	DOT	False	abs	10000	1	-30000	Zellverfall			Zieht für einen bestimmten Zeitraum immer nach $H_W_BAD1s$COLOR_END $H_W_BAD10%$COLOR_END der Gesamt-LP ab. Zieht danach $H_W_BAD-30000.0$COLOR_END der Gesamt-LP ab.$BRZellverfall kann nicht entfernt werden.	icon_status.delaydamage_tex	icon_status.delaydamage_tex	True
47702200	BuffNearbyParty	DOT	False	swch	10000	4	477022	Fluch der Königin			Verringert immer nach $H_W_BADsecond$COLOR_END die Gesamt-LP aller Gruppenmitglieder in Eurer Umgebung um H_W_BAD10%$COLOR_END.	icon_status.minuswill_tex	icon_status.minuswill_tex	True
47702300	BuffNearbyParty	Buff	False	seta	10000	4	477023	Ursprung der Arroganz der Königin			Erhöht Eure Kraft sowie die aller Gruppenmitglieder in Eurer Umgebung um $H_W_GOOD30%$COLOR_END.	icon_status.pluswill_tex	icon_status.pluswill_tex	True
